"Easy (and Kid-Friendly!), Beef Weeknight ', <b>Meals</b",https://www.thebump.com/a/easy-and-kid-friendly-beef-weeknight-meals,"Are you a working mom who wants some easy meals under your belt? Are you a stay-at-home mom who doesn't have a bunch of time (or hands!) available to make dinner? No matter your situation, we all want to have some easy meals at our disposal. Here are some meal ideas for you that are centered around hamburger. (See my other post on meal ideas involving chicken.) Since many of these use browned beef, you could easily brown all the hamburger at the same time, reserving some for later use. Mess up 1 pan and get many meals out of it!Meal Idea #1: Simple Macaroni and Beef with CheeseSlightly Adapted from Michael RuhlmanServings: 4-6 (easily)Tip: This is very easy to pull together or to make on the weekend and then pop in the oven when ready to bake. If you do bake it straight from the frig, you'll want to increase the baking time since it isn't starting from room temperature. Check the source for instructions on freezing  this is very freezer friendly!Ingredients: 1 large onion, diced 1 tablespoon canola oil salt to taste optional seasonings: black pepper, oregano, cumin, coriander, chopped garlic, hot smoked paprika, chilli powderwhatever youre in the mood for 28 ounces can tomatoes, petite diced or crushed 2 pounds lean ground beef 1 box macaroni 1 cup each grated cheddar and mozzarella cheesesDirections:Cook the onions with the oil and a little salt.Add the beef and cook it, breaking it up as you do. Add the seasonings that you've chosen.  AdvertisementAdd the tomatoes, bring to a simmer, then reduce the heat to low and cook for an hour.Cook the macaroni in boiling water till its half done. Drain it and add it to the tomatoes.Stir it into the sauce. Taste it. Add more salt and other seasonings as needed, and cover.When its cooled and the pasta has absorbed the tomato juices, transfer it to a 9x13 baking dish and cover it with foil.Bake in a 400 degree oven till its piping hot (about 45 minutes if its cold to room temperature). Just before youre ready to eat, remove the foil, cover macaroni with the cheese and broil till it looks beautiful.Meal Idea #2: Baked Cream Cheese SpaghettiSource: Plain ChickenIngredients: 12 oz spaghetti 1 (28 ounce) jars prepared spaghetti sauce 1 lb lean ground beef 1 tsp Italian seasoning 1 clove garlic, minced (or 1/2 tsp minced) 8 ounces cream cheese, softened 1/2 cup parmesan cheese, gratedDirections:Preheat oven to 350 F degrees.In a skillet, brown the ground beef until cooked through; drain fat and stir in spaghetti sauce. Set aside.Cook spaghetti according to directions on packet. Drain and place cooked spaghetti in bowl.Add cream cheese, Italian Seasoning and minced garlic to spaghetti. Stir until cream cheese is melted and the spaghetti is thoroughly coated.Lightly grease a 9x13 pan. Spread a small amount of meat sauce in the bottom of the dish.Put spaghetti on top of sauce and top with remaining meat sauce. Sprinkle parmesan cheese on top.  AdvertisementBake for 30 minutes, until bubbly.Meal Idea #3: French Bread PizzaSource: The Frugal GirlTip: This is a recipe that isn't really a recipe. It's just a way of thinking of making pizza a little outside of the box. Pizza doesn't have to be on pizza dough. You can make pizzas on top of other types of bread - including french bread, hamburger buns, hoagie buns or english muffins. In this way, it can be very easy to put different toppings on each person's pizza.Ingredients: French bread loaves Prepared tomato sauce Shredded mozzarella cheese Pizza toppings like ground hamburger, pepperoni, green peppers, onion, mushroomDirections:Cut the French bread loaves in half lengthwise. Place on cookie sheet. Sometimes to add more toppings, I remove some of the bread inside to hollow it out a little bit. Don't remove too much, otherwise it will get soggy.Spread them with pizza sauce.Sprinkle the pizzas with mozzarella cheese.And add whatever toppings you like.Bake in a preheated 400 degree oven for 10-15 minutes, or until the crust is crispy and the cheese is melted.Meal Idea #4: Oven Baked Meatball SubsSource: Home Cooking MemoriesTip: If you cooked the meatballs the night or weekend before, you could just microwave the meatballs and sauce the day you want to prepare the meal, saving time.Ingredients: Sandwich rolls (cut with one side intact) Cooked Meatballs (your favorite recipe or frozen, pre-made meatballs) Pasta Sauce (homemade or jarred) Shredded Mozzarella CheeseDirections:  AdvertisementSpray a baking sheet with cooking spray. Preheat oven to 400 degrees F.Place your frozen cooked meatballs or homemade cooked meatballs in a large pot.Cover with your pasta sauce. Gently fold the meatballs with the sauce.Heat the meatballs and sauce on low-medium, stirring occasionally, until the meatballs are heated thoroughly.Fill a roll with as many meatballs as you can fit (usually 4-5 meatballs, depends on size of meatballs and the size of the roll). Top with more pasta sauce from your pot.Place filled sandwich rolls closely on baking sheet. Top each sandwich with shredded mozzarella cheese. You can put into a 9x13 pan if you need a smaller pan.Bake until cheese is melted, hot, and bubbly.Meal Idea #5: Taco SoupTip: This one is great for the crockpot! But it doesn't take too long to heat up, so I tend to make it on the weekend, let it simmer for just a couple of hours in the crockpot, then reheat it on the week night that I want it.Ingredients: 1 lb ground beef 1 onion, chopped 1 pkg taco seasonings 1 pkg dry Ranch seasonings 2 large cans diced tomatoes, undrained 1 can Rotel tomatoes, undrained 1 can each: black beans, pinto beans, whole kernel corn. (optional) sour cream, Frito chips, cheese (I like Fritos!)Directions:Brown meat and onion. Drain. Add seasonings.Drain beans and corn. Add to meat along with tomatoes.Simmer until well blended and hot.Add a bit of cheddar cheese, sour cream or Fritos when serving.  AdvertisementWhat are your favorite, easy weeknight meals?PHOTO:The NestRelated Video"
8 Nutrition Tips For Plus-Size Pregnant Women Sunny Sea Gold ...,https://www.thebump.com/a/healthy-plus-size-pregnancy,"In general, overweight women should aim to gain between 15 and 25 pounds during pregnancy, while obese women should aim for 11 to 20. A plus-size pregnancy is a higher-risk pregnancy, so following weight-gain guidelines is that much more vital, says Margaret Wertheim, a registered dietitian nutritionist in Madison, Wisconsin. And keep in mind: Pregnancy isnt the time to start dieting. I definitely do not recommend pregnant women restrict themselves to the point of depriving their bodies or their babies of the calories they both need, Wertheim says. Instead, focus on eating nutrient-dense real foods emphasizing protein, healthy fats, vegetables, and fruit while limiting foods with added sugar. Read on for more tips on eating for two.Tip #1: Go lighter on the carbs.Overweight or obese women are more likely to have elevated blood sugar levels, which can lead to having a large baby, so Wertheim doesnt recommend consuming lots of carbs. Whats more, many carbohydrate-rich foods, like sweets, soft drinks, bread, pasta and chips, generally aren't super-rich in vitamins and minerals compared with beans, nuts, meats or veggies. But cutting them out altogether can lead to growth retardation, says Romy Block, MD, an endocrinologist who sees patients in a high-risk obstetrics clinic in Chicago. Stick to healthier sources of carbs, like fruit, dairy products and whole grains, which will give you and baby the nutrients you need.Tip #2: Slash your sugar intake.I always suggest that mommies-to-be reduce refined sugars and starches, says Julie Kabat Friedman, a health psychologist specializing in obesity and weight management and an assistant professor at the Northwestern University Feinberg School of Medicine. Were not saying you have to go cold turkeyyou can still have your treats. Just heed Friedmans advice to be mindful of portion size and make eating sweets a planned part of your day, instead of whenever you feel like it.  AdvertisementTip #3: Focus on lean protein.While youre cutting back on carbs and sugar, focus on filling your plate with more lean protein, like chicken breast, sirloin cuts of beef, beans, fish, tofu and low-fat dairy. Theres evidence that doing this helps prevent excessive pregnancy weight gain, decreases the risk of gestational diabetes and helps you feel more full, Friedman says.Tip #4: Try dividing your plate.Block suggests following this easy formula to get the right balance at every meal: Just divide your plate into quarters. Fill one quarter with lean protein, another with grains/complex carbs and fill the last two with veggies or a salad. Do this three times a day and youll have packed your day full of healthy nutrients, without overdoing it.Tip #5: Stick to a meal schedule.Stress eating can kick in for many pregnant women, especially in the third trimester when anxieties over big issues (delivery, child care, finances!) pop up. Friedman suggests creating a schedule that includes eating three meals and two snacks each day at a set time. Eating according to the clock helps prevent skipping a meal or overindulging, and it can help reduce emotional decision making about food. Need a few more ways to fight those stress-induced cravings? Try changing your environment (take a walk around the block or go run an errand) or distracting yourself with an enjoyable activity that doesnt involve food, like emailing a friend or browsing online for baby names.Tip #6: Check your prenatal vitamin for iodine.Getting enough folic acid and calcium during pregnancy is a no-brainer, but theres another necessary mineral you probably havent heard about. One especially important nutrient that has come to light recently is iodine, says Wertheim. Its essential for proper thyroid function and for baby's brain development, but about one-third of pregnant women in the United States are iodine-deficient. Check the label of your prenatal vitamin to see if it includes 150 microgams of iodine, and talk to your OB about the right dosage for your particular needs.  AdvertisementTip #7: Get those zzzs!Have you ever noticed its like a thousand percent harder to eat right when youre extra tired? Lack of sleep makes your body want to eat more, but then its too sleepy to burn off those extra calories, Friedman explains. Chances are heartburn, leg cramps or vivid dreams are going to disrupt your sleep at least some nights, but you can make sure you get the best rest possible by having a set wake and sleep time, and taking a hot shower before bed. Your body cools down after getting out of the hot shower, and that process has a relaxing, sleep-inducing effect, she says.Tip #8: Dont try too hard to be perfect.You and your body are going through a lot right now, and its important to be kind to yourself through this memorablebut stressfulexperience. Preventing excessive weight gain during pregnancy has health benefits for both mom and baby; but the same goes for stress, says Friedman. If eating perfectly while pregnant is stressing you out too much, take a step back and dont beat yourself up if you have to give into the cravings once in a while. No mother should feel overly pressured about weight during pregnancy, Friedman says.Plus More From The BumpNutrition During PregnancyWeight-Control Tips for Plus-Sized Pregnancy6 Tricky Things About Your Plus-Sized PregnancyRelated Video"
7 Quick and Easy Recipes for New Moms,https://www.thebump.com/a/easy-recipes-new-moms,
"Light ', <b>Meal</b>, u' Safe During Labor, Anesthesiologists Suggest",https://www.thebump.com/a/meals-safe-during-labor,"For most moms, labor is definitely a marathon, not a sprint. And after discovering the caloric demands of laboring women are literally comparable to those of marathon runners, researchers are suggesting that a light meal during labor would be beneficial.Sure, eating might not be top priority as you battle your way through contractions, but a lack of adequate nutrition comes with consequences. By not eating, women's bodies will begin to turn to fat as an energy source, upping the level of acidity in mom and baby's blood. This can potentially reduce contractions, resulting in longer labor and worse newborn health.Typically, women have been told to avoid eating or drinking during labor because of the aspiration risk inhaling liquid or food into their lungs, which is linked to pneumonia. But after reviewing hundreds of studies on the topic, researchers concluded this is not a concern for healthy women. Between 2005 and 2013, only one laboring mom was reported to have aspirated in the United States, and she experienced complications frompreeclampsia and obesity.Wondering why the recommendation to eat is just being made now? Thanks to improvements in anesthesia care (think epidurals and spinal blocks as opposed to masks and windpipe tubes), it's the first time health professionals feel comfortable allowing light eating to accompany pain management. The research was presented last month at theannual meeting of the American Society of Anesthesiologists.Our findings suggest a change in practice makes sense, says Christopher Harty, BN, co-author of the study. Physician anesthesiologists and obstetricians should work together to assess each patient individually. Those they determine are at low risk for aspiration can likely eat a light meal during labor. This gives expectant mothers more choices in their birthing experience and prevents them from being calorie deficient, helping to provide energy during labor.  AdvertisementSo what's it gonna be? Start placing your delivery room orders.Related Video"
Feeding Gear That Will Change Your Life,https://www.thebump.com/a/must-have-feeding-gear,
Best Foods For Baby (and What To Avoid) Erika Rasmusson Janes,https://www.thebump.com/a/best-foods-for-baby,"When it comes to feeding baby, theres no ""Top 10"" list of super foods for moms to print out, stick on the fridge and stick to. (Sorry!) But experts agree that limiting your little one to a few best foods in her first year (or any year, for that matter) would actually do her a disservice. ""The first year of life is when the palate is trained,"" says Tina Ruggiero, MS, RD, LD, coauthor of The Best Homemade Baby Food on the Planet. ""The three rules I tell my clients to follow are: Go for color, think fresh and introduce new flavors and different textures at age-appropriate stages. Following these guidelines, parents will find more than 10 fruits, more than 10 vegetables and more than 10 proteins to try."" And while you'll also want to talk with baby's pediatrician for guidance, adding the following great options to babys dietand avoiding a few first-year no-no foodswill get him or her off to a healthy start.Breast MilkWeve all heard (and heard, and heard) that breast is best. But just because baby is ready to move beyond the boob doesnt mean you should stop nursing. After all, the American Academy of Pediatrics (AAP) recommends exclusive breastfeeding for about six months. But the organization also recommends that breastfeeding continue along with solid fooods until baby is 12 months oldor longer, if it works for both mom and baby. The very best food for the first year is breast milk, says Loraine Stern, MD, FAAP, coauthor of the book Nutrition: What Every Parent Needs to Know.Best Age for Breast Milk: Birth and older  AdvertisementIron-Fortified CerealBaby is born with a natural supply of iron, but itll be depleted by the time shes around 6 months old, Stern says, so introducing iron-rich foods is essential. One that fits the bill: iron-fortified cereal. It doesnt have to be the traditional first food of rice cerealoatmeal and barley are good options toojust make sure you start with a single-grain formula.Best Age for Iron-Fortified Cereal: Four to six monthsAvocadosAvocados are a great first fruit to offer baby, because theyre loaded with monounsaturated fats (thats the good kind!) and have a mild taste and smooth consistency. Theyre super-easy to prepare too: Simply mash a very ripe avocado with a little breast milk or formula until it reaches a pureed consistency.Best Age for Avocados: Six months and olderSweet PotatoesOkay, so theres no baby super foodbut sweet potatoes come pretty close. According to The Best Homemade Baby Food on the Planet, theyre one of the most nutritious foods for baby. Why? Theyre rich in beta-carotene, which the body converts to vitamin Aand thats important for good vision, healthy skin, normal growth and protection from infections. Plus, many babies like the soft, pudding-like texture of pureed sweet potatoes, says Susan Casey, RD, CD, pediatric clinical dietitian at Seattle Children's Hospital.Best Age for Sweet Potatoes: Six months and olderMeatMeatlike chicken, lamb or beefis an excellent source of protein, as well as iron, riboflavin, niacin, vitamin B6 and zinc. Just make sure its pureed to a smooth texture. (According to Nutrition, for infants, even finely chopped meat may be hard to handle and cause choking.) Try mixing the pureed meat with breast milk and a favorite veggie puree if youre preparing it yourself, or buy plain pureed jarred meats.Best Age for Meat: 7 to 10 months and older  AdvertisementBeetsBeets are an extraordinary nutrient source, says Ruggiero. Theyre a good source of folic acid, high in potassium and beta-carotene, and theyre a sweet veggiewhich babies take a liking to quickly. Roast or steam them until theyre super-soft; then mash them.Best Age for Beets: 11 months and olderYogurtPlain (not vanilla) whole-milk yogurt is another protein-rich option for babyplus, it contains calcium and beneficial live active cultures. (Confused as to why yogurt made with cows milk is okay for babies, but actual cows milk isnt? Very simply, lactose is already broken down with the culturing of the yogurt, and milk proteins are either removed or limited, so its easy for baby to digest, says Ruggiero.)Best Age for Yogurt: Nine months and olderCheeriosBelieve it or not, many experts love good old-fashioned Cheerios. The little Os in the yellow box are an excellent finger food and a good source of fiber. I dont think childhood would exist without Cheerios, says Stern.Best Age for Cheerios: Nine months and olderA FEW FIRST YEAR NO-NOSHoneyTempted to sweeten up babys bland pear sauce with a touch of honey? Dont. According to Nutrition, Honey is linked to infant botulism, an illness that can be fatal. The tummies of babies under age one simply cant deactivate the botulism spores that might be in honey, Stern says. So avoid this food until baby has passed his or her first birthday.Nuts and PeanutsYou can introduce small amounts of creamynot chunkypeanut butter when your child is one year old (try spreading a thin layer on a cracker), but avoid nuts in whole form until he or she is 4 years old to prevent choking.  AdvertisementCows MilkBabies just cant easily digest cows milk, which is one reason why experts recommend waiting until the one-year mark before offering it.Plus, more from The Bump:Baby Food Taste Test: What the Littlest Critics LikedBaby Food Recipes for Every StageWhen to Start Solid FoodsPHOTO:ShutterstockRelated Video"
Sample Baby Schedules: 10-Month-Olds The Bump Editors,https://www.thebump.com/a/baby-schedule-10-month-old,"Daily schedule for a 10-month-old, breastfed baby girl (submitted by Tina)7 a.m. Wake up and nurse her.8 a.m. Breakfast and play time.9  10 a.m. Go upstairs to get ready for her morning nap. Nurse her to sleep.11 a.m. Wakes up and is nursed again. Gets dressed for the day.Noon Lunch and play time1:40 p.m. Go upstairs for afternoon nap. Nurse her to sleep.3:30 p.m. Nurse her, play, maybe go for a walk or shop.5:40 p.m. Dinner time! Afterwards, we play and on some nights take a bath.7 p.m. Go upstairs for bedtime routine with dad (change into pajamas and read a book).7:20 p.m. Nurse her to sleep. Typically, nighttime nursing sessions occur at 10 p.m., midnight and 4 a.m.Dailyschedule for a 10-month-old, formula- (and solids!) fed baby boy (submitted by Amanda)6:30 - 7 a.m. Wake, eats 7 oz. formula7:30 - 8:30 or 9:00 a.m. Play9 - 11 a.m. Nap11 a.m. - 12 p.m. Play12 p.m. Eats 1/2 Gerber 2nd foods fruit and some Gerber oatmeal, 5 oz. formula12:30 - 1 p.m. Play1  3 p.m. Nap3 - 4 p.m. Play4 - 4:30 p.m. 7 oz. formula4:30 - 6:30 p.m. Play (Were transitioning away from an evening nap depending on baby's mood. Some days he naps at this time, and some days he doesn't.6:30 p.m. Dinner (Depending on what the family is eating, he the meal were having, or he gets rice cereal and 1/2 Gerber 2nd foods veggie.)  Advertisement7 p.m. Bath7:30 - 8 p.m. Bed timeBaby typically sleeps through the night. If he wakes, it's only once. We reinsert his pacifier and he's back to sleep in seconds.Daily schedule for a 10-month-old, breastfed (and supplemented with formula) baby boy (submitted by Jen E.)6 a.m. Wake upTalk about mobile animals and stretch in cribChange diaperHe begs to be fed (breastfeeding).We calmly play together for 20 minutes.He rolls around on the floor for 20 minutes.Breakfast. He has some Gerber fruit and puffs, Cheerios or other cereal.He watches momma eat.We play together until he looks sleepy.Change diaperHe breastfeeds until he falls asleep.8:30 a.m. Nap10 a.m. Wakes upHe plays for 15-20 minutes in his roomChange diaperBreastfeedExersaucer while I do dishesWe walk around for a little12 p.m. Lunch. He has fruit and a veggie (sometimes meat and sometimes cereal).He watches momma eat lunch.We play for a little until hes tired. (He rolls around on the floor.)Change diaperBreastfeed until he falls asleep1 or 1:30 p.m. Nap3 p.m. Wakes upWe play in his room for 20 minutes (Sometimes I nap on the floor!)Change diaperBreastfeedPlay4 p.m. Snack. Usually a banana or an orangePlay and wait for daddy to get homeDiaper changeLast breastfeeding ""snack""5:30 p.m. Daddy gets home and we figure out dinner for everyone5:30 - 6 p.m. Dinner. Fruit and veggie (sometimes meat and sometimes cereal)  AdvertisementHe watches momma and daddy eat dinner. Usually, he has something off our plates, too.Diaper change7 p.m. Daddy/baby timeIf its bath night (every 3 nights):7:15 p.m. 2-ounce formula bottle7:30 p.m. Bath, lotion with songs, put things away8:00 p.m. 4 oz Formula bottle, prayers, mobile song, put baby in crib awake. He sucks his thumb to fall asleep.If its not bath night:7:15 p.m. 2-ounce formula bottle7:45 p.m. Lotion with songs, put things away8:00 p.m. 4-ounce formula bottle, prayers, mobile song, put baby in crib awake. He sucks his thumb to fall asleep.Hes asleep by 8:30 p.m. and sleeps sound most nights until 6 a.m.Get advice on baby schedules.Related Video"
How Often Should a Toddler Poop?,https://www.thebump.com/a/how-often-should-toddler-poop,"When it comes to toddler poop, consistency counts much more than frequency. Some toddlers poop once a day, and thats fine. Others poop every three days or so, while still others poop three or more times per day.Instead of focusing on the number, take a look at the consistency. You want to see a reasonable amount thats reasonably soft and does not cause bleeding, says Michael Lee, MD, a pediatrician at Childrens Medical Center in Dallas. You dont want to see very small, hard, ball-like stools that may or may not cause bleeding with defecation  those are signs of constipation. Very runny, frequent, watery poops are a sign of diarrhea.If you do notice signs of constipation, try cutting back on the milk. Milk (and other dairy products) are often the chief culprit in toddler constipation. Substitute water or juice for some milk, and your toddler may soon find relief. If not, talk to your doctor or pharmacist.If your child has diarrhea, he probably has a stomach virus. Offer fluids frequently to prevent dehydration. Avoid sugary juices or sodas, though, as the sugar in the drinks can actually increase the number of stools. Water and milk are fine. If your child is up to it, he can also have small amounts of soft, bland foods such as crackers, rice and yogurt.Plus, more from The Bump:Baby Symptoms and Conditions Guide Best Potty Training Books for Toddlers Healthy Meal Ideas for ToddlersRelated Video"
