"7 Healthy ', <b>Meal</b>, u' Ideas for Pregnancy",https://www.thebump.com/a/healthy-recipes-pregnancy,
"What are good ', <b>meal</b>, u' options to cook and freeze?",https://www.thebump.com/a/good-meals-to-cook-and-freeze,"Squirreling away some precooked meals in your freezer before baby arrives will cut down on some of the stress (and take-out!) during your first weeks as a parent. After a sleep-deprived night and exhausting day of tending to babys every need, youll feel like you hit gold when you open the freezer and see it stocked with delicious, homemade, heat-and-eat meals. Soups, stews, casseroles, lasagna, and pasta sauces are best for freezing. Meals can be stored in the freezer for up to three months before they spoil or before flavors are affected.*Food-Freezing Tips:*The nemesis of frozen food is oxygen. If youre freezing something in a bag, get rid of excess air before sealing it. If youre using a plastic container, make sure it has a tight-fitting lid and use the smallest size that will fit what youre freezingUse freezer zip-top bags. You may end up with freezer burn if you use sandwich-style bags  they are too thin.Freeze in single or double portions and use freezer zip-top bags. It saves room in your freezer, makes for quick thawing (just submerge item in hot water), and lets you defrost only what you need.If you arent sure how best to freeze a certain item (or long it will keep), check the National Center for Home Food Preservationwebsite.Freezer-Friendly Recipes:12 Make-Ahead Freezer Meals for Moms-to-beHere are some more of our favorite healthy and hearty, freezer-ready meals from The Nest:Turkey ChiliHealthiest-Ever LasagnaBaked Pasta with Roasted Wild Mushrooms in a Creamy Thyme Sauce  AdvertisementZesty Beef CasseroleSquash StewFind more recipes from The Nest.*Updated 10/27/2011Related Video"
"12 Make-Ahead Freezer ', <b>Meals</b>, u' for Moms-to-be",https://www.thebump.com/a/freezer-meal-recipes,
"How to Make One ', <b>Meal</b>, u' for the Whole Family",http://www.thebump.com/a/double-duty-baby-food,"About a year ago, when my son Archie started eating solids, I was excited about introducing him to a whole new world of foods. I like to cook, and imagined hanging out with Archie as he experienced his first tastes of everything from apples to curry. But every book I found on cooking for kids assumed that things like taste and fun were irrelevant to babies and toddlers.That seemed wrong-headed to me, so I scrapped the books and started making my own concoctions, eventually coming to the common-sense realization that with a few small modifications he could eat the same foods as us  right from the start.Not only would that  hopefully  keep him from being one of those kids who only eats pasta and cheese, it would save me the time in the kitchen, and likely improve all our diets to boot!After experimenting on my own for a while, I called up my chef pal Marisol and asked her advice on recipes that could do double-duty. Together, we came up with some simple tips for making the most of your of your meals  for mama, and baby.Tip #1: Don't Be Afraid of Herbs and SpicesPediatricians tend to discourage adding much, if any, salt or sugar to baby food. Why? Going from breast milk, which has the least sweet of the sugars, to processed food with corn syrup or even stevia, its possible that your child will always reach out for sweeter foods, says Dr. Jatinder Bhatia, Chief of Neonatology at Childrens Hospital of Georgia and Georgia Regents University in Augusta, Ga., and the current chair of the American Academy of Pediatrics Committee on Nutrition. We really try to encourage people to make their own foods so we can address children's sugar and salt intake early on.  AdvertisementCooking from scratch gives you control here. But that doesn't mean baby food has to be bland! Babies can handle all kinds of herbs and spices, and introducing them early on will make them more open to trying new tastes as they grow.Not sure where to start? Try adding thyme to carrot purees, cinnamon to sweet potatoes or butternut squash, and curry or garlic to pureed kale or chard. Herbs and spices not only help keep things interesting for baby, but can also offer a health boost. Ginger will help when they have a stomach bug, says Dr. Amy Maidenberg, pediatrician and owner of Sage Pediatrics in Oakland, Calif. And garlic has known immune benefits. I tend to recommend using all the herbs and spices you can, in moderation. The more variety, the better.Tip #2: Maximize Your OptionsNo time to hit the grocery store? No worries. Dont fret about cilantro when parsley will do just fine. Just because a recipe calls for a certain ingredient, doesnt mean you must use it. Many fruits and vegetables have multiple varieties  and most have easy swaps, in terms of taste and health benefits.So use what works, depending on the season, whats in the fridge and what baby (and you, of course) love to eat.Remember: you can cook the same recipe any number of different ways. If a recipe calls for sweet potatoes, but it's squash season, for example, try substituting butternut. Similarly, if your baby doesn't seem to like one particular type of sweet potato, try others (purple-skinned sweet potatoes tend to be starchier and less sweet, while the orange-red skinned varieties tend to be sweeter). Texture and flavor can vary wildly between different varietals of the same fruit or vegetable, and those changes can make the difference between a puree your baby loves and one he or she spits out every time.  AdvertisementTip # 3: Be PreparedWhichever fruits and veggies your family likes, keep an assortment of them on hand. I like to roast a pan of mixed vegetables every week  handy for easy purees and salads. Keep a couple of baskets of berries around to grab for a snack or puree for a healthy addition to yogurt or oatmeal.Also, stocking the pantry with easy go-tos makes life simpler on busy weekdays. Make and freeze chicken stock  or stash some of your favorite by your favorite low-sodium organic brand  for easy sauces. Keep a variety of whole grains and pastas on hand for quick fixes. Learn what works best for your clan, then keep those go-to staples within easy reach.Tip #4: Sneak Veggies in EverywhereEven the best little eater will suddenly decide at some point that they don't like this or that. The smart-mom solution? Learn how to sneak in veggies wherever you can. Mix chard and kale into the dough for homemade veggie pasta, blend greens with apple juice for a super-healthy and tasty smoothie, mold veggie mashes into balls or small patties that can be flash fried in olive oil and easily grabbed by chubby little hands.Tip #5: If You Eat Meat, They Eat MeatIf you're not a vegetarian, and you plan on serving your child meat at some point, it's a good idea to start early. ""I'm a big fan of iron-rich foods early on, so I recommend sardines or liver as one of the first five foods my patients try, unless they're vegetarian,"" Dr. Maidenberg says. Concerned about baby's ability to chew and swallow meat? Go for easy-to-puree options and gradually work your way up as baby gets more teeth.  AdvertisementTip #6: Help Them Help YouAs early as 9 months, most babies want to start feeding themselves. And once that urge kicks in, don't fight it, embrace it! But forget spoon-feeding  finger foods are where its at. Luckily, many of the foods you've given them early on can be transformed into handy snackers with a little ingenuity. Pureed carrots easily transform into bite-sized munchies, and apple sauce converts to sturdier slices when babys ready.The good news: the more things baby can feed himself, the longer he'll be willing to sit in a highchair or booster seat. The added bonus? Many finger foods can come along in the car, too, without too much mess or fuss._Looking formeal ideasfor the whole family? Check out these recipes! _Plus, More from The Bump:Genius Baby-Food Storage IdeasMost Stylish High ChairsFeeding Gear That Will Change Your LifeRelated Video"
"What Is The Six-', <b>Meal</b>, u' Solution?",https://www.thebump.com/a/six-meal-solution,"Three square meals might have been the lesson of the day when you were in grade school, but now that youre all grown up  and eating for two  you may find that number just doesnt work. Some experts think eating smaller, more frequent meals (specifically, five or six mini meals instead of the old breakfast, lunch and dinner) can help alleviate some of the discomforts of pregnancy, including nausea, gas, bloating, constipation, headaches and fatigue. These mini meals can help keep your blood sugar levels stable, so youre not facing big peaks and valleys (of energy and mood!) that can come with bigger meals. And since youre already adding an extra 300 calories a day to help support your babys growth (about twice that if youre carrying twins), you can take advantage of these extra eating opportunities. Remember that your baby gets the nutrients he needs first, so make sure those mini meals are healthy ones, with plenty of fruits, vegetables, whole grains, low-fat dairy and lean protein to support his growth.Plus More From The Bump:Your Pregnancy DietGuidelines To Eating Right While PregnantIs Exercise Safe During Pregnancy?Related Video"
Top 10 Baby Food Cookbooks,https://www.thebump.com/a/best-baby-food-cookbooks,
7 slides Top 7 Packaged Baby Foods Kylie McConville,https://www.thebump.com/a/packaged-baby-foods,
Your Pregnancy Diet,https://www.thebump.com/a/your-pregnancy-diet-meal-plans-nutritional-tips,"Now that you're pregnant, you're probably getting hit with a ton of advice on what's safe and what's off-limits  especially when it comes to fitness and nutrition. A little overwhelmed by all the info? Not to worry; we're hear to clearup some of the confusion. From grocery list staples to exercise dos and don'ts, we've gota plan forhowyou canstay healthy for the next nine months.** ***Your Four-Step Plan* > Step One: Learn the basics.Get ready for some Prenatal Nutrition 101.> Step Two: Clean out that pantry.Read tips on what to toss and what to bulk up on.> Step Three: Rework your grocery list. Find out what you shouldbeaddingand why.> Step Four: Plan ahead.Get ideasfor healthy meals and on-the-go snacks.Food: What's Safe, What's Not > Q: What foods should I avoid?> Q: How much fish should I be eating?> Q: Can I be a vegetarian while pregnant?> Q: How much calcium should I get?> Q: Are soft cheese okay to eat?> Q: Is lunch meat safe to eat?> Q: Can I still eat seafood?Exericise Dos and Don'ts> Q : Can I stick to my current workout routine?> Q: Whatactivities aren'tsafe while pregnant?> Q: Is it safe to do Pilates while pregnant?> Q: Is yoga safe to do during the third trimester? ** Q:** Can I lift weights while pregnant?> Q: Is it safe to do yoga in the first trimester?> Q: Can I take regular gym classes, or only prenatal ones?** Cool Tool: Pregnancy Workout Plan   Advertisement**Looking for a prenatal workout plan that changes with you through each stage of your pregnancy? Look no further. Print out our easy-to-follow pregnancy workout plan, custom-made by fitness expert Tracey Mallett.>> Download the workout > Join the discussion: Chat with other mamas-to-be on our health &exercise board.Related Video"
"15 Creative ', <b>Meal</b>, u' Ideas For Toddlers",https://www.thebump.com/a/creative-meal-ideas-for-toddlers,
10 slides Top 10 Baby Food Recipes For 8- To 10-Month-Olds Kylie ...,https://www.thebump.com/a/baby-food-recipes-8-to-10-month-olds,
Your Pregnancy Diet: A Starter's Shopping List,https://www.thebump.com/a/your-pregnancy-diet-a-starters-shopping-list,"Now that youre pregnant, your overall diet needs to be well-balanced to ensure that you and baby get the right amount of vitamins and minerals. A little overwhelmed by all the eat this, not that advice youve been getting lately? We dont blame you. So lets make things simple: Heres a cheat sheet of what to add to your shopping list (if they arent on it already) the next time youre cruising the grocery aisles:The Basics Whole grains Whole wheat bread Brown rice Bran cereal Black beans Lentils Lima beans Chickpeas Citrus fruit Broccoli Tomatoes Spinach Kale Sweet Potatoes SquashEating lots of different-colored fruits and veggies will help you get in an array of vitamins and minerals. Citrus fruits, broccoli and tomatoes are good sources of vitamin C, which will promote healthy skin and gums, among other things. Dark, leafy greens are a great way to get in the vitamin A, folate and iron that you need during pregnancy and breastfeeding. Sweet potatoes and squash are high in fiber and rich in vitamins A and C and make a great choice for a nutritious side dish or as ingredients in soups and casseroles. Spinach is also a good source of iron. Now that extra blood is circulating in your body, youll need to get more iron in your diet so you dont become anemic. Plus, opting for veggies and whole grains that are high in fiber will keep you feeling full. They're also low in fat and help alleviate constipation. Foods that are high in folic acidlike spinach, lentils, chickpeas and morewill also help develop babys nervous system.  AdvertisementProteinSince protein is one of the essential building blocks for muscle, tissue, and all sorts of other new cells, getting the required amount is crucial when youre pregnant. (Its also important after pregnancy, when youre exercising and trying to build up new muscle.) Browse this list of options to make sure youre working enough protein into your diet each day: Organic chicken Turkey (fresh, not deli meat) Beef Lamb Veal Liver Ham Wild salmon Milk Yogurt Soy milk Tofu Pasteurized cheese Eggs In addition to protein, dairy offers up calcium, which helps build bones and strong muscles. If you dont consume enough, babys bones steal calcium from yours, which ups your risk of osteoporosis later in life. You can look for brands of yogurt that are fortified with folic acid and Vitamin D. Vegetarian RecommendationsIf youre a vegetarian, youll want to pay extra attention to the amount of protein youre getting at every meal (consider popping a vitamin B12 supplement each day too). Try incorporating as many of these veggie-friendly foods in your diet as possible: Legumes Black beans Navy beans Pinto beans Peas Soybeans Tofu Tempeh Whole grains Natural peanut butter Flaxseed Olive oilFlaxseed, while rich in protein, is also a good source of DHA (also found in salmon, wheat germ and nuts), which is crucial during pregnancy in helping baby's brain, cells, and retinal, nervous and cardiovascular systems develop properly. Related Video"
How Much Solid Food Should Baby Eat? Bonnie Vengrow ...,https://www.thebump.com/a/how-much-solids-to-feed-baby,"When you start feeding baby solids  usually around four to six months  start small. One to two ounces of food per meal is totally fine, says Satya Narisety, assistant professor in the Department of Pediatrics at Rutgers University. Follow babys cues. If hes showing hes not into it by keeping his lips closed or by turning away, hes had enough. Gradually increase the amount of food to about four ounces, three times a day by the end of his sixth month.At eight months, bump up the amount of solids to six to eight ounces per meal, three times a day, with two two-ounce snacks in between, Narisety says.Remember: Baby still gets most of his nutrition from breast milk or formula. If youre nursing, continue breastfeeding five to seven times a day (depending on how much baby takes in at each feeding  you'll have to follow his cues). If youre bottle-feeding, aim to give 24 ounces of milk in a 24-hour period by the time hes eight months of age. Easy enough, right?Plus, more from The Bump:Solid Food Starter GuideWhat Solids Should I Feed Baby When?When Should I Give Baby a Spoon?Related Video"
"Q&A: Eating Right During Pregnancy? Denise Gershwin, CNM ...",http://www.thebump.com/a/eating-right-during-pregnancy,"Good nutrition during pregnancy is essential the nutrients you give your body are the building blocks of strong, healthy growth for baby. During the next nine months, you'll need about 300 more calories perday than usual. The best way to get these in is by sneaking in two or three healthy snacks between three small meals. Eating frequent small meals (as opposed to a few large meals separated by long period without calories or nutrients) help baby get maximum benefit from what you eat. Here are a few more ways to give baby a healthy start (and keep yourself comfortable):[] Drink eight to ten glasses (80-100 oz) of water each day[] Pick fruits, vegetables and whole grains, which are healthy and prevent constipation[] Eat high iron foods such as liver, shellfish,lean meat, poultry, fish, dried beans, green leafy vegetables and whole graincereals and breads[] Choose whole grains over sugar cereals and whitebread[ ] Avoid excessive caffeine (found in most sodas, coffee,tea, chocolate)[] Don't skip meals  even if you don't feelhungry, baby needs the nourishment[] Use our prenatal nutrition checklist to keep track of food groups and servings every dayRelated Video"
"Your Biggest ', <b>Meal</b>, u' Should Be Breakfast If You Want To Get Pregnant",https://www.thebump.com/a/your-biggest-meal-should-be-breakfast-if-you-want-to-get-pregnant,"While previous studies have hinted that eating like a Greek might help you conceive, there's one thing we can all agree on (feta-lover or otherwise): A hearty, healthy breakfast is more important than you would have ever thought. Sure, you'll need your nutrients and vitamins to power through the day, but did you ever think that tucking in for a big breakfast could actually help you conceive? Oh yeah, it can.The latest research reveals that eating a good breakfast has a positive impact on women struggling with infertility. Researchers at the Hebrew University of Jerusalem and Tel Aviv University found that a big breakfast increases fertility amongst women that suffer from irregular periods.The study set out to understand whether meal times have an impact on the health of a woman with irregular periods due to Polycystic Ovary Syndrome. Currently, PCOS affects 6 to 10 percent of women. So researchers followed 60 women aged 25 to 39 over a 12-week period. Each of the women suffered from PCOS and had a body mass index (BMI) of less than 23.From there, researchers led by Professor Oren Froy, Professor Daniela Jocabovitz and Dr. Julio Weinstein divided the women into two groups; each was allowed to consume 1,800 calories a day. The only difference between the two groups was when the women at their biggest meal. 30 of the women ate their biggest meal at breakfast while the remaining 30 ate theirs at dinner.Here's what they found:Women who ate their biggest meal at breakfast had decreased glucose and insulin levels (down by 8 percent), compared to the diner group who showed levels that remained virtually the unchanged. Also in the breakfast group, researchers noted that testosterone levels were down by nearly 50 percent. But the most telling was that women were ovulating at a much higher rate when they had their biggest meal at breakfast.  AdvertisementOf the findings, Froy said that the research ""clearly demonstrates that indeed the amount of calories we consume daily is very important, but the timing as to when we consume them is even more important.""Do you think it's important to eat a healthier, bigger breakfast?PHOTO:Thinkstock / The BumpRelated Video"
6 No-Stress Tips For Eating Out With Baby Erin van Vuuren,https://www.thebump.com/a/eating-out-with-baby,"There's no reason to leave baby behind for a family meal on the townwell, if you have the right game plan, that is. Check out these pointers from Tammy Gold, founder of Gold Parent Coaching, and you and baby will be enjoying your favorite restaurant together in no time.1. Mentally prepFirst things first, know what you're getting into. The key to a smooth dinner is parent prep, says Gold. Decide what your child is ready for, anticipate what could happen (tantrum, diaper explosion), determine how to prevent it and consider what you'll do if it happens anyway. Just thinking about how you'll handle these little blips is really half the battle.2. Pick the right locationLook for places with lots of space to walk around, says Gold. This way, you can take a tour of the place before the meal, and maybe a tour while you're waiting for the food. Keeping baby engaged and moving around can really help blow off some steam and keep him from getting bored (i.e. cranky). Look for venues with some interesting distractions toomaybe theres a large painting or an aquarium in the restaurant. A playground across the street? Even better. Definitely stay away from places with dim lights and fine crystal. No time to scope it out ahead of time? Call to see if they offer high chairs or boosters. If not, that's your sign that they probably aren't used to tiny patrons.3. Time it wellHungry babies are rarely happy, so definitely work within your child's schedule. If it's not possible to actually eat during baby's mealtime, Gold recommends feeding him at home and then bringing along a snack as a distraction. If dinner will last through bedtime, consider pulling the stroller right up to the table, and don't forget any blankies or other bedtime soothers. Try not to make plans that will keep you out late, though. A 1-year-old can't go out to dinner at nine, she says.  Advertisement4. Bring toysMost importantly, Gold suggests bringing along a special stock of restaurant-only toysnovel goodies that baby doesn't get to play with at home or in the car. Boredom is the biggest trigger of tantrums and bad behavior, Gold says, explaining that baby's amusement is all up to you. If their needs are met, you can meet yours. And tactile stimulation is best. Go for small, sturdy books and items with bright colors. The real trick, though, is to reserve your ammo. If you have 15 toys and present them all at once, you won't get very far, says Gold. Instead, give one at a time, maximizing your time and baby's attention span. Make the most of the tools you've got, and you might even make it to dessert.5. Set it upBe sure to clear away any dangerous items from the table and anything that baby might grab and hurl. Also, take notice of built-in toys (especially if your own stash is skimpy). Gold is a strong believer in the power of a few empty plastic cups and says that plastic spoons and jelly packets work great too. For older babies, you can make eating a hands-on project. Cut up the food. Let them hold it. Let them dip it in the ketchup. These are all ways to lengthen their ability to engage, she says. And, for the actual seating arrangements, bring along a backup in case the high chairs are all taken. Chicco's 360 Rotating Hook-On Booster Chair is a great portable option that lets baby face the table to eat or face outward to interact with you, the Stokke Xplory stroller lifts right up to table height and the Kaboost portable high chair booster raises a toddler's restaurant chair to grownup level.  Advertisement6. Go with itKeeping baby at bay is seriously an art. The key is to engage, engage, engageand then you can have your freedom, says Gold. In other words, if baby keeps busy, you can do more eating and chattingand less retrieving of the sippy cup from three booths over. And if it's just not working out? Hey, you tried. It can take some serious practice to learn what works best to keep your child engaged and happy. It might not go the way you planned this time. Or next time, Gold admits. But you'll get it. And about all those squished fries under the table? Don't forget to tip your server.PHOTO:ShutterstockRelated Video"
