Is Peanut Butter Safe During Pregnancy? Jenna McCarthy,https://www.thebump.com/a/peanut-butter-pregnant,"Even the pros are iffy on this one. Thats because different studies have found different results: One study (published in the Journal of Allergy and Clinical Immunology) of babies who had previously been diagnosed with egg or milk allergies found that those whose moms had eaten peanuts frequently during pregnancy (two or more times a week) were more likely to develop sensitivity to peanuts than babies of moms who avoided peanuts were. The more often the moms munched the legumes, the higher their babies chance of developing the sensitivity. But note that the babies in this study already had tested positive for other food allergies, so its not entirely clear whether moms cravings can be blamed. Another study published in _The New England Journal of Medicine _found no statistically significant relationship between moms pregnancy peanut consumption and allergies in her child.If youre not allergic to peanuts, yes, you can enjoy an occasional PB&J, says Hilda Hutcherson, MD, clinical professor of obstetrics and gynecology at Columbia University Medical Center. But you may not want to overindulge  and its not because of potential allergies. Peanuts are a good source of protein, but they also have a lot of calories, Hutcherson adds. In other words, if you dont want to put on more pregnancy weight than recommended, you may not want to be putting away cans and cans of peanuts. But in moderation, good, natural peanut butter (look for the kind made of nothing but nuts and maybe a dash of salt  no sugar) can be a healthy part of your gestational diet.  AdvertisementIf you _are _allergic to peanuts or any other food, youre already avoiding it (or should be). Still, theres no sense freaking out about passing your allergy along. According to the Cleveland Clinic, babies inherit a tendency to be allergic; they dont necessarily inherit specific allergies. Talk to your doctor about how your specific food allergies could impact your pregnancy and whether or not you should be extra cautious about what youre eating.Plus, more from The Bump:Allergies During PregnancyFood Allergies in BabiesFoods to Avoid During PregnancyRelated Video"
7 Weeks Pregnant - Pregnancy Week-by-Week,https://www.thebump.com/pregnancy-week-by-week/7-weeks-pregnant,"7 Weeks PregnantYoure keeping the best kind of secret, arent you? Now that youre seven weeks pregnant, youre going about your day knowing youre expectingbut no one else can see it. That can give you a surreal feeling! And at week 7 of pregnancy, youre probably wondering what things will be like once its obvious to everyone that youve got a baby growing in there. For now, enjoy your little secret.How Big Is a Baby at 7 Weeks?At 7 weeks pregnant, baby is the size of a blueberry. Your embryo measures about .51 inches, having doubled in size since last week. He or she doesn't exactly tip the scales just yet, but is developing like crazy inside your 7-week pregnant belly.7 Weeks Pregnant Is How Many Months?Seven weeks pregnant means youre one month and about two weeks pregnant.7 Weeks Pregnant SymptomsBeing 7 weeks pregnant can cause a whole range of symptoms. Some are no biggie and some can make it difficult to get through your day. These are a few of the most widespread:Nausea. Morning sickness may be going strong at week 7 of pregnancy. Hang in there, and try to find ways to cope. Some moms-to-be have success with ginger, Vitamin B-6, and acupressure wristbands easing their tummy troubles. When your hormones become more normal in the second trimester, the nausea should decrease or even disappear. Moms-to-be who are 7 weeks pregnant with twins may be more likely to have nausea and vomiting, since they likely have heightened levels of the hormones that cause morning sickness.Food cravings and/or aversions. You may find yourself with the urge to eat specific or even weird foodsor not wanting to go anywhere near certain foods you used to think were fine (or even delicious!). Food aversions are natures way of keeping you away from potentially dangerous foods, and typically go hand-in-hand with morning sickness. It's okay to give in to your cravings and indulge here and there. But try not to go too crazy, and make healthy food choices when you can. *__ Frequent urination.__ If it seems like you have the urge to pee constantly, its not your imagination. Even though you probably dont look pregnant yet, your uterus has already doubled in size, and you also have increased blood flow to your pelvis.Acne. Breakouts are due to hormonal changes in your body. Before you use any acne fighting products, check with your doctor to make sure theyre safe during pregnancy.Extra saliva. Heres a symptom you never expected! The excess saliva is probably also hormonally triggered and could be related to nausea too.Mood swings. Not only are your hormones out of whack, but you're probably still getting used to the idea of being pregnant, and that can make you become extra emotional.Cramping and/or spotting. Cramping in early pregnancy is normal. After all, theres a lot happening inside your uterus, and even though it will be several weeks before you feel baby move, you can certainly feel plenty of cramping and pulling at this point in your pregnancy. Also, your cervix may be more sensitive now that youre pregnant, so spotting at 7 weeks could happen after sex. These two pregnancy symptoms can be alarming, but know that in most cases, theyre not a sign of ectopic pregnancy or other types of miscarriage. If you were to have abdominal pain worse than typical menstrual cramps or bleeding during pregnancy at 7 weeks thats heavier than a period, that would be a cause of worry, and you should call your doctor right away.That said, at 7 weeks pregnant, you may very well have no symptoms at all. If thats the case, consider yourself lucky! Some moms-to-be worry that having no symptoms at 7 weeks could be a sign of a problem, but its absolutely not. Well keep reminding you that every woman experiences pregnancy slightly differently. If you have any concerns, definitely bring them up to your OB, but unless your symptoms at 7 weeks pregnant are severe or painful, its all likely normal.7 Weeks Pregnant BellyCaught yourself staring at your 7 weeks pregnant belly in the mirrorand even pushing it out to fake a baby bump, just to get a preview? Yeah, we did that too during week 7. Every mom-to-be is different, but many report starting to show in the middle of the second trimester when the uterus outgrows the pelvis. Moms-to-be who are 7 weeks pregnant with twins should expect to show earlier than that, but at this point, its nothing but bloating for everyone.7 Weeks Pregnant UltrasoundHow amazing is this? Your 7-week embryo is generating about one hundred new brain cells each minute! And not only is baby's brain becoming more complex, but the heart is too. Also important: Baby's developing a permanent set of kidneys, and arm and leg joints are now forming as well.At seven weeks pregnant, youre gearing up for your first prenatal visit with your OB, and youre probably dying to know what to expect. Brace yourself to give a variety of samples (blood, urine, and cervical cells for a pap smear), get an ultrasound that will confirm babys doing okay in there, and get an estimated due date (yep, you might already have one, but the doc may adjust it a bit based on what she sees).A 7-week ultrasound isnt common, since many OBs dont see their low-risk pregnancy patients until sometime between weeks 8 and 10it depends on your health history and your doctors preference.With all the waiting, your mind may be full of curiositymaybe even wondering whether you could be expecting more than one baby. There are symptoms of twin pregnancy at 7 weeks besides seeing two gestational sacs on an ultrasound. For example, if you had a blood test to determine your pregnancy, your doctor would have found a higher level of the pregnancy hormone hCG in your blood. Some twin moms have earlier and/or more severe morning sickness (due to the hCG), and of course, moms of multiples may start to show earlier.Pregnancy Checklist at 7 Weeks PregnantReminders for the week:Read up on prenatal tests you can expectMake some pregnancy-safe beauty swapsCheck which OTC medicines are safe"
MTHFR A1298C \u2014 The Bump,,
Whole Milk vs. Skim Milk for Women \u2014 The Bump,,
Does lactose intolerance go away when you're pregnant?,,
Top 10 Baby Food Cookbooks,https://www.thebump.com/a/best-baby-food-cookbooks,
How Hard to Pack Soil When Repotting a Plant,,
Constipation During Pregnancy,https://www.thebump.com/a/constipation-during-pregnancy,"What is constipation during pregnancy?You probably already know that constipation is having trouble going number two.What are the signs of constipation during pregnancy?You might have that stopped up feeling, abdominal discomfort or have feces that are dry or hardened. Going to the bathroom could be difficult or painful.Are there any tests for constipation?Nope. You know it when youve got it.How common is constipation during pregnancy?Its super-common! The American Pregnancy Association says approximately half of all pregnant women get constipated at some point during their pregnancy.How did I get constipated?During pregnancy, elevated progesterone levels cause smooth muscle to relax, which slows the passage of food through your intestines. This increases water absorption from the bowel and results in constipation. Your rapidly growing uterus, which compresses your intestines and pushes your stomach upward, also contributes to the problem. Stress, lack of exercise and a low-fiber diet can make you constipated too.How will constipation affect my baby?It wont be a problem for baby. For you, the constipation will probably just be a nuisance, but in some cases, it does lead to serious medical problems such as hemorrhoids, rectal bleeding and rectal fissures.Whats the best way to treat constipation during pregnancy?The first step in treating constipation is to make sure youre drinking lots of water (at least eight glasses a day), consuming enough fiber (as in fruits and vegetables) and getting ample activity (try walking 20 to 30 minutes daily). If the constipation persists, Metamucil or a mild stool softener such as Colace can help. If youre taking iron supplements, these may be contributing to your constipation  talk with your doctor about possible alternatives. In general, mineral oils, oral laxatives, enemas and rectal suppositories should be taken only after discussion with your physician, because they may stimulate labor.  AdvertisementWhat can I do to prevent constipation during pregnancy?Drink plenty of water and keep eating those fruits and veggies. Staying active can help prevent constipation too.What do other pregnant moms do when they have constipation?Ive had some constipation lately, and the only thing that seemed to ease it was Metamucil (recommended by my doctor).Ive been constipated on and off throughout this pregnancy  its one of those symptoms that can be heavily influenced by what you eat. I take Colace to keep things moving when I start to feel a little constipated, but Ive also been eating apples daily to try to keep things moving naturally (without medication)  it really does help!I had some severe constipation a couple weeks ago, and it is certainly not fun. I suggest getting a bottle of prune juice. Between drinking a glass of prune juice, eating an Activia yogurt and taking one Colace, my constipation has turned around.Are there any other resources for constipation?American Pregnancy AssociationPlus, more from The Bump:Staying Hydrated During PregnancyHemorrhoids During PregnancyGas and Bloating During PregnancyRelated Video"
"Lump In A Baby's Abdomen Wendy Sue Swanson, MD Pediatrician",https://www.thebump.com/a/lump-baby-abdomen,"Whats a lump in a babys abdomen?Often newborns develop whats known as an umbilical hernia, a fairly common condition that occurs soon after birth or in the first couple of months. Youll see a noticeable bulge or soft swelling over the belly button (which is why its called umbilical), especially when your child sits up, cries or strains. In some cases, a lump in the abdomen for a baby or a toddler can indicate a more serious condition, like an underlying blood, kidney or liver problem.What could be causing a lump in my babys abdomen?If its an umbilical hernia, it was caused by a small opening in the abdominal muscle: When he was still in your belly, those blood vessels that passed nutrients from you to your child never fully closed. Swollen lymph nodes can also sometimes appear as small lumps (which increase in size when your child has a cold or virus). A more serious  but unlikely  cause of an abdominal lump may be a tumor.When should I take my baby to the doctor with a lump in his abdomen?Watch to see if there are changes. However, if the lump suddenly becomes larger, harder or darker and cant easily move (or be pushed back in), or if your child starts to experience severe pain or vomiting, call your doctor right away. He may have developed whats known as an incarcerated hernia, where a portion of the intestine becomes trapped (yup, incarcerated), and blood flow to the area is limited. Most often the lumps go away on their own, but if youre concerned, point them out to your doctor.  AdvertisementWhat should I do to treat my babys lump in the abdomen?It all depends on the docs diagnosis  chances are, you wont have to do anything. The vast majority of umbilical hernias go away on their own by the time the child reaches his second birthday.Related Video"
Q&A: Can I Be A Vegetarian While Pregnant? Sandra Le Plasse,https://www.thebump.com/a/can-i-be-a-vegetarian-while-pregnant,"No matter if you're a vegetarian, vegan, or macrobiotic, its important to be aware of your diet during pregnancy. If you believe you dont get enough protein (the building block for babys cells), be sure to talk to your doc. Otherwise, dont stress about it too much. As long as you maintain a balanced diet and keep track of what you eat, your baby should be just as healthy as one born from a mommy who ate meat during her pregnancy.Where to start? Many foods besides meat are rich in protein, including; eggs, soy burgers, tofu, legumes (beans, chickpeas, lentils, peas), whole grains (eat with legumes for a complete protein), nuts and seeds, milk, soy milk, cheese, fruits and vegetables, fermented soy foods, tofu, and peanut butter (try a spoonful straight from the jar).Now that weve got protein covered, its also important to eat certain foods or take prenatal vitamins to get other nutrients found in meats:[] Vitamin B12 is found in eggs, fortified yeast extract, and dairy products.[] Zinc is found in wheat, oats, rice, barley, and rye.[] Iron is found in whole grains, legumes, green veggies, and dried fruits.[] Omega-3 fatty acid is found in flax seed (yum) and walnuts.[] Vitamin D and calcium is found in green vegetables, almonds, milk, tofu, cheese, yogurt, whole-grain cereals, and legumes.Even if you cant stand the taste of soy milk or whole grains, keep in mind that eating healthy is essential for babys growth. You can always end your not-so-tasty balanced meal with a delicious desert because, well, you deserve it.Related Video"
What Is The Six-Meal Solution?,https://www.thebump.com/a/six-meal-solution,"Three square meals might have been the lesson of the day when you were in grade school, but now that youre all grown up  and eating for two  you may find that number just doesnt work. Some experts think eating smaller, more frequent meals (specifically, five or six mini meals instead of the old breakfast, lunch and dinner) can help alleviate some of the discomforts of pregnancy, including nausea, gas, bloating, constipation, headaches and fatigue. These mini meals can help keep your blood sugar levels stable, so youre not facing big peaks and valleys (of energy and mood!) that can come with bigger meals. And since youre already adding an extra 300 calories a day to help support your babys growth (about twice that if youre carrying twins), you can take advantage of these extra eating opportunities. Remember that your baby gets the nutrients he needs first, so make sure those mini meals are healthy ones, with plenty of fruits, vegetables, whole grains, low-fat dairy and lean protein to support his growth.Plus More From The Bump:Your Pregnancy DietGuidelines To Eating Right While PregnantIs Exercise Safe During Pregnancy?Related Video"
"Can Baby Be A Vegetarian? Jennifer Mellick, MD Pediatrician",https://www.thebump.com/a/baby-vegetarian,"There are three main types of vegetarians (and a few sub-types)  all of them eat no meat.Lacto-ovo vegetarians: They dont eat animal flesh but do eat eggs and dairy products.Lacto vegetarians: They eat dairy products but no other animal products.Vegans:They eat no animal products  including honey and gelatin. Find out if a vegan diet is safe for baby here All vegetarians should plan their diets carefully so that theyre not deficient in certain vitamins and minerals such as vitamin B12, calcium, vitamin D and iron.Its relatively easy for baby to be vegetarian when he starts eating solid foods, usually between four and six months old. Some signs that can help you know that babys ready to eat solids are: shes sitting up, she opens her mouth for a spoon and closes her lips over a spoon, shes able to let you know if shes full or hungry, she keeps her tongue low and flat when you put the spoon in her mouth, and shes showing an interest in food while others around her are eating. All vegetables and fruits can be pureed and given to a vegetarian. A vegetarian baby can get protein-rich foods from pureed tofu, cottage cheese, cheese, yogurt and egg products, and strained legumes (like beans, peas, chickpeas and lentils). He should get a variety of fruits and veggies  and stay away from unhealthy foods that could be considered vegetarian, like potato chips that are fried in canola oil, or soda. Feed baby iron-fortified cereal to prevent iron-deficiency anemia.  AdvertisementThe bottom line  a baby on breast milk or formula can get a good balance of nutrients on a vegetarian diet. Ensure baby is growing at a healthy rate with regular checkups with her pediatrician. The American Academy of Pediatrics (AAP) recommends screening all babies for iron deficiency between 6 and 12 months  whether theyre vegetarian or not. It is also recommended that all breastfed babies and formula-fed babies who receive less than 32 ounces of formula daily, receive a vitamin D supplement.When baby grows to toddler age, its important to monitor her nutrient intake because toddlers tend to be picky eaters. Recently, the AAP began recommending a 30-month well-child visit to keep tabs on picky eaters health. Most toddlers, especially vegetarians and vegans should be on a multivitamin that contains iron.Plus, more from The Bump:Can baby be vegan?Safe solids for babyBest foods for baby?Related Video"
Q&A: What is hydramnios?,https://www.thebump.com/a/what-is-hydramnios,"There are two types of hydramnios: oligohydramnios, which means there's not enough amniotic fluid around baby, and polyhydramnios, which means there's too much.If there's not enough fluid, it could mean several things. It could mean your water has broken and some of the fluid has leaked out. Or it could be that baby's not peeing enough (yup, amniotic fluid is made of baby's pee), which could be a sign baby's not getting enough blood and nutrients from the placenta. The problem with not having enough fluid is that there may not be enough cushion for the umbilical cord, so it could compress, and baby might not get adequate blood flow from it. How oligohydramnios is treated will depend on what's causing it. If you're close to your due date and your doctor is concerned about baby's well-being, she may choose to deliver.In the case of too much fluid, there's no treatment necessary, but your doctor will watch you closely since the excess fluid could make your uterus contract and cause preterm labor.Related Video"
Eating Fish During Pregnancy Could Keep Moms-to-Be From ...,https://www.thebump.com/a/eating-fish-during-pregnancy-could-keep-moms-to-be-from-feeling-anxious,"Eating fish during pregnancy : is it a do or a major don't?According to the latest research, feasting on fish while you're expecting could lower a mom-to-be's risk of anxiety.The study, published in the journal PLOS ONE, involved more than 9,500 women that the researchers grouped based on their dietary patterns. One group of women was labeled as ""health-conscious"" and included women who ate mainly fruits, salads, fish and cereals. Another grouping, the ""traditional"" dietary eaters ate mostly vegetables, red meat and chicken. There was also a ""vegetarian"" grouping, a grouping of women who ate mostly processed food and a final grouping of women who ate a diet rich in sweets. The researchers followed women that rarely (or never) ate dark or oily fish (like tuna and salmon) and found that they were 53 percent more likely to have high levels of anxiety in their third trimester of pregnancy, when compared to women who ate fish at least once a week during their pregnancies. Also noted in the study is that vegetarian women that followed a strict vegetarian diet were also 25 percent more likely to have anxiety during their pregnancies when compared to women that followed a more flexible vegetarian diet that occasionally included fish and sometimes meat. Researcher attribute the link between higher fish consumption and a lower risk for anxiety to the omega-3 fatty acids found in fish.At 32 weeks, women involved in the study were asked to complete questionnaires. Those who scored in the top 15 percent were classified as having high levels of anixety.  AdvertisementStudy author Juliana Vaz, researcher at the Federal University of Pelotasin Brazil said that, ""In order to have a healthy pregnancy, women need to follow a healthy diet, and not something special for pregnancy."" Researchers defined a healthy diet as one that included whole grains, vegetables, poultry, meat and fish. At the conclusion of the study, researchers noted that, ""Because of the demands of a growing fetus, pregnant women need higher amounts of nutrients. The lack of fish and meat in a vegetarian diet may explain why vegetarian women in the study tended to experience more anxiety.""At the 32 weeks of pregnancy, the women completed questionnaires, and those who scored in the top 15 percent were classified as having high levels of anxiety.While researchers are still working out just how a low omega-3 diet may result in heightened anxiety, they think that it could be due to the fact that low omega-3s in the blood may disrupt communication between cells, which would affect how the body responds to psychological stress.But how do you know which fish are safe to eat during your pregnancy?Here's how to stay on the safe side:Fish and shellfish are good sources of high quality protein and other essential nutrients like omega-3 fatty acids. But, some types of fish do contain more mercury than others  eat these in limited amounts, or avoid them entirely. Keep in mind the following basic rules, and check out the FDA or EPA for more extensive info.Never eat shark, swordfish, king mackerel, or tilefish.Limit lower mercury fish such as canned light tuna, shrimp,salmon, catfish, and tilapia to 12 ounces (two average meals) a week.Albacore white tuna has more mercury than canned light tuna, so limit your intake to one serving (six ounces) per week.Fish sticks and fast-food sandwiches are usually made from low mercury fish. (And that's the only time we'll recommend the drive through!)  AdvertisementWhat about shrimp?Shrimp is safe to eat because it falls into the category of low-mercury seafood, which also includes salmon, pollack, sardines and catfish. But you should still limit your intake of these fish to no more than 12 ounces per week, says Laura Riley, MD, director of labor and delivery at Massachusetts General Hospital and author of You & Your Baby: Pregnancy.Did you eat fish when you were pregnant? If so, what types?PHOTO:Getty Images / The BumpRelated Video"
